{"edges":[{"enabled":true,"evidence_rate_per_second":0.8121463839088613,"id":"edge-0","left":0,"right":1,"wave_rate_radians_per_second":-10.871373293425359},{"enabled":true,"evidence_rate_per_second":10.116713863720804,"id":"edge-1","left":1,"right":2,"wave_rate_radians_per_second":-15.66638379618455},{"enabled":true,"evidence_rate_per_second":0.5970170939999443,"id":"edge-2","left":2,"right":3,"wave_rate_radians_per_second":6.540508094787615},{"enabled":true,"evidence_rate_per_second":8.650459436942967,"id":"edge-3","left":0,"right":2,"wave_rate_radians_per_second":2.86030493885861}],"name":"extension-generation-3-seed-20260814","observers":[{"bias":-0.5594834098159979,"evidence_weights":[-0.8406607901919937,-0.846427216484197,-1.0264574682880339,-1.0553620527658059],"id":"path-order","reservoir_weights":[7.47406686487111e-06,-2.0218389277721283e-08,-7.403568411353602e-06,-4.658216673761258e-05],"wave_weights":[-1.1408867105977094,-2.4404648064549423,1.4528032999763743,-2.029646321410379]},{"bias":0.050682063089689124,"evidence_weights":[-2.2948901593601985,-2.6422517788785727,-2.0861680508459415,2.4148498847402142],"id":"evidence-majority","reservoir_weights":[1.605090267764991e-05,1.0727691300623816e-06,2.8161785272955098e-05,-5.1996490717068405e-06],"wave_weights":[0.19145688018646306,-0.005477020187068026,0.011297303170147125,0.06922543230991922]}],"sample_rate_hz":32.0,"schema_version":"ariadne-local-medium-v1","sites":[{"active_rate_per_second":0.006715348489118068,"active_target_wave_energy":0.7431471805599453,"active_threshold":0.6931471805599453,"evidence_decay_per_second":0.000747425486621254,"id":"site-0","initial_evidence":0.0,"initial_reservoir":0.0,"initial_wave":0.0,"reservoir_capacity":0.9431471805599453,"reservoir_leak_per_second":0.0024756851377304495,"wave_decay_per_second":0.004478233375572337,"wave_metric":2.3019527967212916},{"active_rate_per_second":0.006715348489118068,"active_target_wave_energy":0.7431471805599453,"active_threshold":0.6931471805599453,"evidence_decay_per_second":0.0005735589700225663,"id":"site-1","initial_evidence":0.0,"initial_reservoir":0.0,"initial_wave":0.0,"reservoir_capacity":0.9431471805599453,"reservoir_leak_per_second":0.0024756851377304495,"wave_decay_per_second":0.000863011457716539,"wave_metric":0.7425661148596382},{"active_rate_per_second":0.006715348489118068,"active_target_wave_energy":0.7431471805599453,"active_threshold":0.6931471805599453,"evidence_decay_per_second":0.0006560923492122902,"id":"site-2","initial_evidence":0.0,"initial_reservoir":0.0,"initial_wave":0.0,"reservoir_capacity":0.9431471805599453,"reservoir_leak_per_second":0.0024756851377304495,"wave_decay_per_second":0.0006356286375079038,"wave_metric":0.46402510121493123},{"active_rate_per_second":0.006715348489118068,"active_target_wave_energy":0.7431471805599453,"active_threshold":0.6931471805599453,"evidence_decay_per_second":0.0007275284450668114,"id":"site-3","initial_evidence":0.0,"initial_reservoir":0.0,"initial_wave":0.0,"reservoir_capacity":0.9431471805599453,"reservoir_leak_per_second":0.0024756851377304495,"wave_decay_per_second":0.00048804737675349176,"wave_metric":0.362582742354511}],"sources":[{"evidence_gain":0.6931471805599453,"id":"source-0","site":0,"wave_gain":3.063286235362112,"work_gain":0.6931471805599453},{"evidence_gain":0.6931471805599453,"id":"source-1","site":1,"wave_gain":3.6541983855786744,"work_gain":0.6931471805599453},{"evidence_gain":4.169681368612093,"id":"source-2","site":2,"wave_gain":0.0,"work_gain":0.6931471805599453},{"evidence_gain":3.7833323736144866,"id":"source-3","site":3,"wave_gain":0.0,"work_gain":0.6931471805599453}]}
